{
  "session_id": "demo-session-001",
  "version": 540,
  "updated_at": 1779608506,
  "mode": "practice",
  "current_question": {
    "text": "Explain polymorphism in OOP.\n",
    "type": "Technical/Algorithm",
    "language": "Unknown",
    "timestamp": 1779608474,
    "source": "manual_input",
    "confidence": 0.85
  },
  "rolling_context": {
    "recent_transcript": [
      {
        "speaker": "interviewer",
        "text": "Explain binary search.",
        "timestamp": 1779562602
      },
      {
        "speaker": "interviewer",
        "text": "Explain polymorphism in OOP.\n",
        "timestamp": 1779608474
      }
    ],
    "summary": "",
    "open_threads": []
  },
  "history": [
    {
      "turn_id": "turn-001",
      "question": "Explain binary search.",
      "question_type": "Technical/Algorithm",
      "answer": "1. **Core Concept**: Binary search is an efficient algorithm for finding a target value within a sorted array by repeatedly dividing the search interval in half.\n\n2. **Approach**: The approach involves setting two pointers, `left` and `right`, to define the current search range. In each step, we calculate the middle index and compare the element at this midpoint with the target value. If it matches, we return its position; if not, we adjust the search interval based on whether the target is less than or greater than the midpoint.\n\n3. **Key Steps**:\n   - Initialize `left` to 0 and `right` to the last index of the array.\n   - While `left <= right`, calculate the middle index as `mid = (left + right) // 2`.\n   - Compare the element at `mid` with the target value.\n     - If it matches, return `mid`.\n     - If the target is smaller than the mid-element, move the `right` pointer to `mid - 1`.\n     - Otherwise, move the `left` pointer to `mid + 1`.\n\n4. **Complexity Analysis**: The time complexity of binary search is O(log n), where n is the number of elements in the array. This is because we effectively reduce the problem size by half at each step. The space complexity is O(1) as it uses a constant amount of extra space.\n\n5. **Edge Cases**:\n   - If the target value does not exist in the array, the search will eventually narrow down to an interval where `left > right`, and we return -1 or some indication that the target was not found.\n   - The input array must be sorted for binary search to work correctly.\n\n6. **Interview-Style Summary**: Binary search is a powerful technique that can significantly speed up searches in large, ordered datasets. By repeatedly halving the search space, it ensures logarithmic time complexity, making it much faster than linear search methods. In practice, you would use this algorithm when dealing with sorted data and need to find elements quickly, such as in applications like search engines or database queries. For instance, in our Atlas project, binary search could be used for efficiently searching through a sorted list of candidate answers or questions during the interview process.",
      "agent": "Tech/Code",
      "timestamp": 1779562621,
      "source": "manual_input",
      "critic": {
        "clarity_score": 0.6,
        "correctness_score": 0.8,
        "human_like_score": 0.6,
        "resume_alignment_score": 0.6,
        "privacy_score": 0.95,
        "jd_alignment_score": 0.0,
        "jd_alignment_notes": [
          "回答与岗位 JD 的关联较弱，建议更多结合岗位技术要求。"
        ],
        "final_score": 58,
        "main_weakness": "岗位匹配度偏弱",
        "specific_issues": [
          "回答过于冗长，建议精简要点",
          "回答偏长，面试现场不容易完整说完。",
          "回答与岗位 JD 的关联较弱，建议更多结合岗位技术要求。"
        ],
        "rewrite_strategy": "改写时优先补强岗位 JD 相关技术栈和职责匹配点。",
        "should_rewrite": true,
        "critic_notes": [
          "回答过于冗长，建议精简要点",
          "回答偏长，面试现场不容易完整说完。"
        ],
        "improved_answer_suggestion": "建议改进方向：\n- 回答过于冗长，建议精简要点\n- 回答偏长，面试现场不容易完整说完。\n- 回答与岗位 JD 的关联较弱，建议更多结合岗位技术要求。",
        "human_like_rewrite": {
          "rewrite_available": true,
          "speaking_version": "Binary search is a highly efficient algorithm for finding an item from a sorted list by repeatedly dividing the search interval in half. Let me explain how it works step-by-step with our Atlas project as a context. In our system, we often need to quickly access or find specific information within a large, ordered dataset—like candidate answers or questions during an interview.\n\nFirstly, we initialize two pointers: `left` at the start of the array and `right` at the end. Then, in each iteration, we calculate the middle index and compare it with our target value. If it matches, we return its position; if not, we adjust the search interval based on whether the target is smaller or larger than the midpoint.\n\nFor example, when using binary search to find a specific candidate's answer within our sorted list of responses, we can significantly reduce the number of comparisons needed. This makes our system more efficient and responsive during interviews.\n\nIn terms of complexity analysis, binary search operates in O(log n) time, where `n` is the size of the array. This logarithmic time complexity ensures that even with a large dataset, we can find what we need relatively quickly. The space complexity remains constant at O(1), making it an optimal choice for memory-constrained environments.\n\nIn case the target value doesn't exist in the array, we'll eventually narrow down to an interval where `left` is greater than `right`, indicating that our search was unsuccessful. And of course, the input must be sorted for this algorithm to work correctly.\n\nThis technique is particularly useful in applications like search engines or database queries, and it's a key component in our Atlas project. By implementing binary search, we can enhance the performance of our system and provide faster responses during interviews.\n\n### Short Version:\nBinary search efficiently finds an item in a sorted list by repeatedly halving the search interval. It uses two pointers to narrow down the range, achieving O(log n) time complexity. In our Atlas project, this technique helps us quickly find candidate answers within a large dataset, ensuring fast and responsive performance during interviews.",
          "short_version": "Binary search efficiently finds an item in a sorted list by repeatedly halving the search interval. It uses two pointers to narrow down the range, achieving O(log n) time complexity. In our Atlas project, this technique helps us quickly find candidate answers within a large dataset, ensuring fast and responsive performance during interviews.",
          "rewrite_notes": [
            "Generated by Ollama rewrite prompt."
          ]
        },
        "followup_questions": {
          "followups": [
            "Can you give a concrete example?",
            "What trade-off did you consider?",
            "How would you improve this next?"
          ],
          "followup_focus": "technical"
        }
      }
    },
    {
      "turn_id": "turn-002",
      "question": "Explain polymorphism in OOP.\n",
      "question_type": "Technical/Algorithm",
      "answer": "1. **Core Concept**: Polymorphism is a fundamental principle in object-oriented programming (OOP) that allows methods to use objects of different types but share the same interface. This enables writing more flexible and generalized code, as it can operate on entities without knowing their specific type.\n\n2. **Approach**: To implement polymorphism, classes define methods with the same name but possibly different functionalities based on the object's class or interface. The key is to design your system so that a method call works similarly across multiple types of objects, thanks to inheritance and interfaces.\n\n3. **Key Steps**:\n   - Define an interface or base class with common methods.\n   - Create derived classes that inherit from this base class and override the methods as needed.\n   - Use the base class reference for objects of derived classes in your code. The actual type of the object will determine which method is called.\n\n4. **Complexity Analysis**: Polymorphism can introduce complexity due to the dynamic binding (also known as late binding) involved, where the decision about which method to call is made at runtime based on the object's actual class rather than its reference type. This can improve code flexibility but requires careful design and testing to ensure correct behavior.\n\n5. **Edge Cases**:\n   - Ensuring that overridden methods in derived classes provide the appropriate functionality.\n   - Managing potential issues with type casting or downcasting, where you might need to explicitly convert an object from a base class to its derived class reference.\n   - Overriding methods correctly without breaking inheritance contracts.\n\n6. **Interview-style Summary**: In my project Atlas, we often leverage polymorphism through our multi-agent system and the Critic Agent rules module. For instance, different types of agents can respond to questions in various ways, but they all interact with a shared Blackboard interface. This design allows for flexible and maintainable code while ensuring that each agent's behavior is appropriately encapsulated yet easily accessible within the system.",
      "agent": "Tech/Code",
      "timestamp": 1779608506,
      "source": "manual_input",
      "critic": {
        "clarity_score": 0.6,
        "correctness_score": 0.8,
        "human_like_score": 0.6,
        "resume_alignment_score": 0.6,
        "privacy_score": 0.95,
        "jd_alignment_score": 0.4,
        "jd_alignment_notes": [
          "回答部分体现岗位要求，但还可以进一步强调 JD 相关经验。",
          "回答体现了多 Agent 编排与状态管理能力。"
        ],
        "final_score": 64,
        "main_weakness": "岗位匹配度偏弱",
        "specific_issues": [
          "回答过于冗长，建议精简要点",
          "回答偏长，面试现场不容易完整说完。",
          "回答部分体现岗位要求，但还可以进一步强调 JD 相关经验。",
          "回答体现了多 Agent 编排与状态管理能力。"
        ],
        "rewrite_strategy": "改写时优先补强岗位 JD 相关技术栈和职责匹配点。",